Review,Rating
"Battery life is amazing!!! Lasted 3 days on a single charge 👍",5
"Not worth the money. Cheap build, feels like plastic.",2
"5* product, but shipping was super slow :(",3
"The sound quality? OMG... terrible.",1
"Pretty good overall, but the cable is only 1.2m :/",4
"Excellent keyboard—quiet keys, fast response!!",5
"Item arrived 40% damaged... not happy at all.",1
"Works well, but not compatible with my Macbook.",3
"Love it!! Best purchase of 2024 <3",5
"Meh... it's okay, nothing special tbh.",3
